{
  "schema": "kestrel/run/1",
  "density": "summary",
  "startedAt": "2026-09-02T09:00:00Z",
  "durationUnit": "nanoseconds",
  "precision": 0.0078125,
  "verdict": "missed",
  "remedy": "pay was slower than 200ms at p99. Look at pay's distribution and its failures before changing the load: a tail is usually one of the two.",
  "plan": {
    "arms": [
      {
        "scenario": "checkout",
        "steps": [
          "pay"
        ],
        "plannedUsers": 3000
      }
    ]
  },
  "schedule": {
    "kept": true,
    "heldFor": null,
    "lostGround": false,
    "behindP99": 120319,
    "plannedInterval": 20000000,
    "remedy": null
  },
  "goals": [
    {
      "asked": "pay p99 under 200ms",
      "met": false,
      "measured": {
        "took": 901775359,
        "percent": null,
        "because": null
      },
      "overBy": 350.8876795,
      "stage": null,
      "cannotTell": null
    }
  ],
  "steadyState": {
    "tolerance": 0.125,
    "settledAfter": null,
    "why": "nothing was recorded second by second, so there was no shape to look at"
  },
  "concurrency": {
    "observed": null,
    "fromServiceTime": null,
    "fromResponseTime": null,
    "ratio": null,
    "backlog": null,
    "agrees": null,
    "samples": null,
    "because": "nothing was recorded second by second, so there is no window"
  },
  "probe": null,
  "count": 7,
  "ok": 4,
  "failed": 3,
  "failures": [
    {
      "reason": "status 503",
      "count": 2
    },
    {
      "reason": "ConnectException",
      "count": 1
    }
  ],
  "arrivals": {
    "count": 0,
    "mean": 0,
    "cov": 0.0
  },
  "machine": {
    "cores": 4,
    "jdk": "21.0.2+13",
    "os": "Linux",
    "arch": "aarch64"
  }
}
